{
  "$schema": "https://json-schema.org/draft/2020-12/schema",
  "$id": "https://grandchallenge.ai/schemas/openai_ten_proofs_ramsey_semantic.schema.json",
  "title": "OTP-I Ramsey current-root semantic/nonvacuity audit",
  "type": "object",
  "additionalProperties": false,
  "required": ["schema_version","record_id","candidate_id","result_family","governance","source_authority","formal_authority","definition_concordance","target_audits","nonvacuity","proof_path_evidence","replay_and_axiom_audit","anti_overclaim","disposition","activation","route_controls","claim_boundary"],
  "properties": {
    "schema_version": {"const":"1.0.0"},
    "record_id": {"const":"MF-OTP-I-RAMSEY-SEMANTIC-002"},
    "candidate_id": {"const":"OPENAI-TEN-PROOFS-001"},
    "result_family": {"const":"OTP-I-RAMSEY"},
    "governance": {"type":"object"},
    "source_authority": {"type":"object"},
    "formal_authority": {"type":"object"},
    "definition_concordance": {"type":"object"},
    "target_audits": {"type":"array","minItems":4,"maxItems":4},
    "nonvacuity": {"type":"object"},
    "proof_path_evidence": {"type":"array","minItems":5},
    "replay_and_axiom_audit": {"type":"object"},
    "anti_overclaim": {"type":"object"},
    "disposition": {"type":"object"},
    "activation": {"type":"object"},
    "route_controls": {"type":"object"},
    "claim_boundary": {"type":"string","minLength":500}
  }
}
